{
  "schema_version": "wa_work_evidence.v1",
  "tenant_id": "VO00",
  "work_evidence_id": "11111111-1111-4111-8111-111111111111",
  "source_owner": "nex-ae-api",
  "source_type": "AE_AGENT_RESULT",
  "source_ref": "agent-execution-100",
  "source_revision_ref": "result-1",
  "source_hash": "sha256:1111111111111111111111111111111111111111111111111111111111111111",
  "evidence_kind": "AGENT_EXECUTION_RESULT",
  "actor_type": "AGENT",
  "actor_ref": "agent-100",
  "agent_type_snapshot": "IA",
  "project_ref": null,
  "occurred_at": "2026-10-27T13:00:00Z",
  "observed_at": "2026-10-27T13:00:01Z",
  "classification": "CONFIDENTIAL",
  "evidence_status": "ACTIVE",
  "evidence_hash": "sha256:aaaaaaaaaaaaaaaaaaaaaaaaaaaaaaaaaaaaaaaaaaaaaaaaaaaaaaaaaaaaaaaa",
  "supersedes_evidence_id": null,
  "created_at": "2026-10-27T13:00:01Z"
}
